{
  "schema_version": 1,
  "deck_id": "WINDLESS-BLOOD-GARDEN-002",
  "game_repo": "https://github.com/Yifeeeeei/EraOfArcaneGame",
  "game_commit": "e6908601d0ffd7f538d6eae22d9bd7c18d5c8ecb",
  "parent_deck_id": "WINDLESS-BLOOD-GARDEN-001",
  "status": "active",
  "deck_code": "4611101 // 1021011 1021011 1021013 1021013 1611102 1611102 1611103 1611103 1621001 1621006 1621006 1621011 1621011 1621016 1621016 1621107 1621107 1621112 1621112 1621113 2611001 2611001 2621005 2621006 2621101 2621101 2621108 2621108 2621109 2621109 // 3021001 3021008 3621001 3621003 3621004 3621010 3621013 3621101 3621102 3621103",
  "plan": ["Reach Robert's six-marker attack breakpoint.", "Use real attackers and Spatial Shift to recycle the center lane.", "Stop self-damage once the board presents a lethal clock."],
  "strengths": ["Won on turn 10 with full hero life; Spatial Shift converted the lane into three separate damage opportunities."],
  "weaknesses": ["The exact balance between sacrifice bodies and generic attackers needs more matches."],
  "evidence_matches": ["series-26-room-4685"]
}
