{
  "schema_version": 1,
  "deck_id": "WATER-FROZEN-CLOCK-001",
  "game_repo": "https://github.com/Yifeeeeei/EraOfArcaneGame",
  "game_commit": "92e09fba884d4f217e07440a0eafc02723807a6b",
  "parent_deck_id": null,
  "status": "retired",
  "deck_code": "4211102 // 1021011 1021011 1021013 1021013 1211103 1211103 1221001 1221001 1221004 1221004 1221007 1221007 1221009 1221009 1221103 1221103 1221109 1221109 1221112 1221112 2221003 2221003 2221008 2221008 2221009 2221009 2221014 2221014 2221109 2221109 // 3201001 3221002 3221003 3221004 3221007 3221009 3221012 3221101 3221108 3221109",
  "plan": ["Use mono-Water resources and freeze to clear blockers, then attack physically.", "Treat Sophia as a one-use exact-two-damage bridge."],
  "strengths": ["Rapid Slayer dealt hero damage on turns one and two; the freeze-to-Sophia clear worked exactly once."],
  "weaknesses": ["Zero of three clears converted to hero damage; non-attacking front bodies blocked the rear Archer."],
  "evidence_matches": ["series-31-room-2835"]
}
