{
  "schema_version": 1,
  "deck_id": "EARTH-SHIELD-MENAGERIE-001",
  "game_repo": "https://github.com/Yifeeeeei/EraOfArcaneGame",
  "game_commit": "e6908601d0ffd7f538d6eae22d9bd7c18d5c8ecb",
  "parent_deck_id": null,
  "status": "retired",
  "deck_code": "4411101 // 1021011 1021011 1021013 1021013 1401002 1401002 1421002 1421002 1421102 1421102 1421104 1421104 1421110 1421110 1421111 1421111 1421113 1421113 1421114 1421114 2411101 2421008 2421008 2421009 2421009 2421109 2421110 2421110 2421111 2421112 // 3421101 3421102 3421103 3421104 3421105 3421106 3421107 3421108 3421109 3421110",
  "plan": ["Keep skills unlearned to enable no-skill Earth companions.", "Use Jade and Emerald Eternity for persistent prevention.", "Win through physical Sandworm and Slayer attacks."],
  "strengths": ["Established a durable shield/prevention engine."],
  "weaknesses": ["The defensive engine lacked a reliable bridge to hero damage and produced a stable draw."],
  "evidence_matches": ["series-25-room-6658"]
}
