{
  "schema_version": 1,
  "deck_id": "EARTH-MOBILE-BEATDOWN-003",
  "game_repo": "https://github.com/Yifeeeeei/EraOfArcaneGame",
  "game_commit": "e6908601d0ffd7f538d6eae22d9bd7c18d5c8ecb",
  "parent_deck_id": "EARTH-MOBILE-BEATDOWN-002",
  "status": "experimental",
  "deck_code": "4411101 // 1021011 1021011 1021013 1021013 1401002 1401002 1401101 1401101 1421012 1421012 1421013 1421013 1421016 1421016 1421101 1421101 1421102 1421102 1421114 1421114 2421002 2421002 2421008 2421008 2421009 2421009 2421110 2421110 2421111 2421112 // 3021001 3421003 3421004 3421101 3421103 3421104 3421107 3421108 3421109 3421110",
  "plan": ["Reach six recurring Earth by turn 3 and seven by turn 4.", "Maintain native-Earth physical attack cadence and use Spatial Shift to recycle center-front."],
  "strengths": ["Clean Series 27 metrics reached the resource targets, avoided off-color stranding, and attacked on 11 of 12 turns."],
  "weaknesses": ["Both tests were contaminated by Giant Sandworm Issue #147; late engine-only bodies still became blanks."],
  "evidence_matches": ["series-27-room-0313", "series-28-room-8508"]
}
