{
  "schema_version": 1,
  "deck_id": "WINDLESS-BLOOD-GARDEN-001",
  "game_repo": "https://github.com/Yifeeeeei/EraOfArcaneGame",
  "game_commit": "e6908601d0ffd7f538d6eae22d9bd7c18d5c8ecb",
  "parent_deck_id": null,
  "status": "retired",
  "deck_code": "4611101 // 1611102 1611102 1611103 1611103 1621101 1621101 1621103 1621103 1621112 1621112 1621113 1621113 1621001 1621001 1621011 1621011 1621016 1621016 1621107 1621107 2621101 2621101 2621108 2621108 2621109 2621109 2611001 2611001 2621006 2621005 // 3621101 3621102 3621103 3621104 3621001 3621002 3621003 3621004 3621010 3621013",
  "plan": ["Use Hubert's Feast to damage deathrattle bodies and grow Robert.", "Finish with Robert, Rose Reaper, and deathrattle reach."],
  "strengths": ["Generated sustained sacrifice resources and eventually grew a durable Robert."],
  "weaknesses": ["Robert's attack breakpoint was misread and Rose Reaper was placed outside the center attack lane."],
  "evidence_matches": ["series-25-room-6658"]
}
