{
  "schema_version": 1,
  "deck_id": "WIND-RUSH-005",
  "game_repo": "https://github.com/Yifeeeeei/EraOfArcaneGame",
  "game_commit": "05be3b6074b2d83e8b1bb83fc3c20c204ad37d5d",
  "parent_deck_id": "WIND-RUSH-003",
  "status": "experimental",
  "deck_code": "4311001 // 1321001 1321001 1321002 1321002 1321004 1321004 1321007 1321007 1321008 1321008 1321009 1321011 1321011 1321013 1321016 1321016 1021001 1021001 1021011 1021011 1021013 1021013 2021012 2021012 2021014 2021014 2321009 2321009 1311003 1311003 // 3321001 3321002 3321003 3321005 3321007 3321013 3321014 3321015 3021001 3021009",
  "plan": [
    "Apply printed penetration early.",
    "Use 卡琳娜 to grant penetration to cheap wind spells.",
    "Use 速写卷轴 for a second spell after the first defense is spent."
  ],
  "strengths": [
    "Earlier versions produced turn-four wins.",
    "The bug-free list still generated repeated hero damage."
  ],
  "weaknesses": [
    "Independent wind resources remained less stable after removing 魔法蒲公英."
  ],
  "evidence_matches": [
    "series-08-room-6138"
  ]
}
