{
  "schema_version": 1,
  "deck_id": "FIRE-BURN-004",
  "game_repo": "https://github.com/Yifeeeeei/EraOfArcaneGame",
  "game_commit": "05be3b6074b2d83e8b1bb83fc3c20c204ad37d5d",
  "parent_deck_id": "FIRE-BURN-003",
  "status": "active",
  "deck_code": "4111003 // 1121001 1121001 1121002 1121002 1121005 1121006 1121006 1121014 1121014 1121015 2121003 2121001 2121001 2121004 2121004 2121006 2121011 2121011 2121014 2121014 2021012 2021012 2021014 2021014 1021002 1021002 1021011 1021011 1021013 1021013 // 3121001 3121002 3121003 3121007 3121008 3121011 3121012 3121013 3121014 3121015",
  "plan": [
    "Use independent fire and earth resources rather than relying only on the hero.",
    "Combine physical attackers with direct fire damage and delayed burn.",
    "Use 速写卷轴 to create a second finishing spell after one defense is spent."
  ],
  "strengths": [
    "Repeated hero pressure from different action types.",
    "Can win through blockers and multiple spell defenses."
  ],
  "weaknesses": [
    "The single 灼烧卷轴 substitution was not drawn in its first evidence match."
  ],
  "evidence_matches": [
    "series-13-room-7456"
  ]
}
